{
  "model_name": "qwen2_5_vl_3b",
  "model_type": "vlm",
  "display_name": "Qwen2.5-VL 3B",
  "vocab_size": 151936,
  "hidden_size": 2048,
  "intermediate_size": 11008,
  "num_hidden_layers": 36,
  "num_attention_heads": 32,
  "num_key_value_heads": 4,
  "experts": 1,
  "kexperts": 1,
  "head_dim": 64,
  "vision_hidden_size": 1280,
  "vision_num_hidden_layers": 32,
  "vision_num_attention_heads": 16,
  "vision_intermediate_size": 5120,
  "vision_image_size": 448,
  "vision_patch_size": 14,
  "vision_in_channels": 3,
  "vision_projection_size": 2048,
  "notes": [
    "Qwen2.5-VL parameters are based on public estimates.",
    "Vision encoder parameters may be shared across multiple model scales."
  ]
}
